{
  "task_id": "t-0008",
  "status": "completed",
  "conclusion": "[契约补记 2026-09-30：本任务交付形态为 stdout（brief §交付物明写「答案直接输出在 stdout（pi -p headless）」），交付于 G0 交付契约落地之前。证据取自派单器代写的 agents/pi/transcript.md（含 exit 0、三项验收自核与 PONG-B 单行交付物）] 并发派单验证-乙通过：pi 真实执行且 exit 0，交付物单行「PONG-B | task=t-0008 | team=乙 | provider=deepseek | model=deepseek-v4-flash | status=READY」，全程只读零写入、未触碰 opencode 侧协议文件；与 t-0007 并行运行互不干扰。",
  "completeness": {
    "done": [
      "验收标准 1：pi 进程真实执行且 exit 0",
      "验收标准 2：输出含 PONG-B",
      "验收标准 3：与 t-0007 并行互不干扰（零写入）"
    ],
    "missing": []
  },
  "evidence": [
    {
      "type": "file",
      "ref": "agents/pi/transcript.md",
      "note": "派单器代写的任务记录：prompt 回显 + 三项验收核对表 + PONG-B 交付物原文 + EXIT:0"
    }
  ],
  "blockers": [],
  "artifacts": []
}
